{
  "schema_version": "0.1",
  "probe_set_id": "probe.invisibilidad_relacional.blind.v0_1",
  "design_rules": {
    "neutral_language": true,
    "no_wound_label_in_prompt": true,
    "no_body_prediction_in_prompt": true,
    "same_scale_across_conditions": true
  },
  "primary_outcome": "felt_presence",
  "items": [
    {
      "id": "felt_presence",
      "prompt": "En este momento, ¿qué tan presente te sientes en tu propia experiencia?",
      "response_type": "rating",
      "role": "primary",
      "scale": {
        "min": 0,
        "max": 10,
        "min_label": "muy poco presente",
        "max_label": "muy presente",
        "step": 1
      },
      "status": "experimental_operationalization",
      "source_derivation": "Derivada de la manifestación fuente de desconexión con el entorno y con la propia presencia."
    },
    {
      "id": "space_occupancy",
      "prompt": "En este momento, ¿qué tan fácil se siente ocupar tu espacio sin reducirte?",
      "response_type": "rating",
      "role": "secondary",
      "scale": {
        "min": 0,
        "max": 10,
        "min_label": "muy difícil",
        "max_label": "muy fácil",
        "step": 1
      },
      "status": "experimental_operationalization",
      "source_derivation": "Derivada de la dificultad para ocupar espacio físico o expresivo."
    },
    {
      "id": "expansion_contraction",
      "prompt": "¿Cómo describirías la cualidad general de tu experiencia corporal ahora?",
      "response_type": "bipolar_rating",
      "role": "secondary",
      "scale": {
        "min": -5,
        "max": 5,
        "min_label": "contracción",
        "max_label": "expansión",
        "step": 1
      },
      "status": "experimental_operationalization",
      "source_derivation": "Variable fenomenológica neutral; no es una medición orgánica."
    },
    {
      "id": "expression_impulse",
      "prompt": "¿Qué tan disponible se siente ahora el impulso de expresarte con palabras, sonido o movimiento?",
      "response_type": "rating",
      "role": "secondary",
      "scale": {
        "min": 0,
        "max": 10,
        "min_label": "nada disponible",
        "max_label": "muy disponible",
        "step": 1
      },
      "status": "experimental_operationalization",
      "source_derivation": "Variable experimental vinculada al eje expresivo sin revelar la herida."
    },
    {
      "id": "body_map_free",
      "prompt": "Si notaste una sensación corporal, márcala libremente. Puedes omitirla.",
      "response_type": "body_map_free",
      "role": "qualitative",
      "scale": null,
      "status": "experimental_operationalization",
      "source_derivation": "Registro libre; la interfaz no resalta órganos esperados antes de responder."
    },
    {
      "id": "time_estimate",
      "prompt": "Sin mirar el reloj, ¿cuánto tiempo crees que duró el bloque anterior?",
      "response_type": "duration_estimate_s",
      "role": "context",
      "scale": null,
      "status": "experimental_operationalization",
      "source_derivation": "Control exploratorio de tiempo percibido."
    },
    {
      "id": "free_observation",
      "prompt": "Describe cualquier cambio, imagen, emoción o ausencia de cambio que hayas notado.",
      "response_type": "free_text",
      "role": "qualitative",
      "scale": null,
      "status": "experimental_operationalization",
      "source_derivation": "Campo abierto para no forzar la respuesta hacia categorías del modelo."
    }
  ],
  "timing_points": [
    "baseline",
    "after_each_block",
    "immediate_post",
    "recovery_60s",
    "recovery_180s"
  ],
  "reveal_policy": {
    "model_expectation_hidden_until": "after immediate-post observation is saved; for strict concordance runs, wait until all recovery probes are complete",
    "participant_can_skip": true
  }
}